{
  "schema_version": "5.0",
  "source_schema_version": "3.0",
  "quality_schema_version": "4.0",
  "generated_at": "2026-10-19T04:12:29.615809+00:00",
  "engine": "P01-005",
  "rules_version": "1.0",
  "signals": [
    {
      "metric_id": "US10Y",
      "signal_id": "DATA_QUALITY_GATE_FAILED",
      "direction": "UNKNOWN",
      "strength": "UNKNOWN",
      "confidence": 0.75,
      "value": 0.051,
      "unit": "DECIMAL",
      "evidence": {
        "data_quality_gate": "BLOCKED",
        "source": "FRED / Federal Reserve Board H.15",
        "source_type": "PRIMARY",
        "quality_reasons": [
          "STALE_OBSERVATION"
        ]
      },
      "reason": "DATA_QUALITY_GATE_FAILED"
    },
    {
      "metric_id": "DXY",
      "signal_id": "FIRM_DOLLAR",
      "direction": "RISK_OFF",
      "strength": "MODERATE",
      "confidence": 1.0,
      "value": 101.816,
      "unit": "INDEX",
      "evidence": {
        "data_quality_gate": "PASS",
        "source": "Yahoo Finance via yfinance",
        "source_type": "PRIMARY",
        "quality_reasons": []
      },
      "reason": null
    },
    {
      "metric_id": "VIX",
      "signal_id": "DATA_QUALITY_GATE_FAILED",
      "direction": "UNKNOWN",
      "strength": "UNKNOWN",
      "confidence": 0.75,
      "value": 19.99,
      "unit": "INDEX",
      "evidence": {
        "data_quality_gate": "BLOCKED",
        "source": "Yahoo Finance via yfinance",
        "source_type": "PRIMARY",
        "quality_reasons": [
          "STALE_OBSERVATION"
        ]
      },
      "reason": "DATA_QUALITY_GATE_FAILED"
    },
    {
      "metric_id": "BTC",
      "signal_id": "INSUFFICIENT_HISTORY",
      "direction": "UNKNOWN",
      "strength": "UNKNOWN",
      "confidence": 1.0,
      "value": 82448.8709,
      "unit": "USD",
      "evidence": {
        "data_quality_gate": "PASS",
        "source": "CoinGecko Public API",
        "source_type": "PRIMARY",
        "quality_reasons": []
      },
      "reason": "INSUFFICIENT_HISTORY"
    },
    {
      "metric_id": "ETH",
      "signal_id": "INSUFFICIENT_HISTORY",
      "direction": "UNKNOWN",
      "strength": "UNKNOWN",
      "confidence": 1.0,
      "value": 2421.4658,
      "unit": "USD",
      "evidence": {
        "data_quality_gate": "PASS",
        "source": "CoinGecko Public API",
        "source_type": "PRIMARY",
        "quality_reasons": []
      },
      "reason": "INSUFFICIENT_HISTORY"
    }
  ],
  "summary": {
    "total": 5,
    "risk_on": 0,
    "risk_off": 1,
    "neutral": 0,
    "unknown": 4
  },
  "semantics": {
    "confidence": "Evidence reliability for signal classification; not probability of a market outcome.",
    "recommendation": "Signals are descriptive classifications, not BUY/SELL/LONG/SHORT recommendations."
  }
}